{
  "schema_version": "1.2",
  "run_id": "research-ac-fixture-2026-08-14-empty",
  "as_of": "2026-08-14",
  "collector_version": "1.0.0",
  "query_version": "1.0.0",
  "schema_version_tool": "1.2",
  "tool_versions": {"python": "3.13", "jsonschema": "4.x"},
  "run_status": "collecting",
  "failure_state": null,
  "cohort_targets": {
    "czech_invoice_software": 10,
    "czech_accounting_firms": 10,
    "czech_individual": 10,
    "oss_invoice": 10,
    "studies_comprehensive": 10
  },
  "entities": [],
  "evidence": [],
  "reviews": []
}
