{
  "schema_version": "1.2",
  "run_id": "synthetic-base",
  "as_of": "2026-08-14",
  "collector_version": "synthetic-test",
  "query_version": "synthetic-test",
  "schema_version_tool": "1.2",
  "tool_versions": {
    "python": "3.13.0",
    "jsonschema": "4.23.0"
  },
  "run_status": "schema_valid",
  "failure_state": null,
  "cohort_targets": {
    "oss_invoice": 10,
    "czech_invoice_software": 10,
    "czech_accounting_firms": 10,
    "czech_individual": 10,
    "studies_comprehensive": 10
  },
  "entities": [],
  "evidence": [],
  "reviews": []
}
